[
 {"upper":"550E8400-E29B-41D4-A716-446655440000","braces":"{550e8400-e29b-41d4-a716-446655440000}","nohyphen":"550e8400e29b41d4a716446655440000","urn":"urn:uuid:550e8400-e29b-41d4-a716-446655440000","mixedcase":"550e8400-E29B-41d4-a716-446655440000"},
 {"upper":"6BA7B810-9DAD-11D1-80B4-00C04FD430C8","braces":"{6ba7b810-9dad-11d1-80b4-00c04fd430c8}","nohyphen":"6ba7b8109dad11d180b400c04fd430c8","urn":"urn:uuid:6ba7b810-9dad-11d1-80b4-00c04fd430c8","mixedcase":"6ba7b810-9dad-11d1-80b4-00c04fd430c8"}
]
